{
  "$schema": "http://json-schema.org/draft-07/schema#",
  "title": "BetterHitreg",
  "description": "Client-side hit feedback for Minecraft Bedrock.",
  "type": "object",
  "properties": {
    "version": {
      "title": "Version",
      "type": "integer",
      "default": 1,
      "readOnly": true
    },
    "enabled": {
      "title": "Enabled",
      "description": "Turns the whole mod on or off.",
      "type": "boolean",
      "default": true
    },
    "hitreg": {
      "title": "Hit prediction",
      "description": "Show the hurt flash on the target before the server confirms the hit.",
      "type": "object",
      "default": {
        "hurtFlash": true,
        "reconcileWindowMs": 250,
        "hurtCooldownMs": 500
      },
      "properties": {
        "hurtFlash": {
          "title": "Predict hurt flash",
          "description": "Flash the target as soon as you attack it.",
          "type": "boolean",
          "default": true
        },
        "reconcileWindowMs": {
          "title": "Confirmation window (ms)",
          "description": "How long to wait for the server's own hurt event before counting a ghost hit.",
          "type": "integer",
          "default": 250,
          "minimum": 50,
          "maximum": 1000
        },
        "hurtCooldownMs": {
          "title": "Hurt cooldown (ms)",
          "description": "No new prediction for the same target this soon after its last flash.",
          "type": "integer",
          "default": 500,
          "minimum": 0,
          "maximum": 2000
        }
      }
    },
    "alerts": {
      "title": "Alerts",
      "description": "Diagnostics written to the launcher log.",
      "type": "object",
      "default": {
        "delays": false,
        "delayThresholdMs": 120,
        "ghosts": false
      },
      "properties": {
        "delays": {
          "title": "Log late confirmations",
          "description": "Log when the server confirms a hit later than the threshold.",
          "type": "boolean",
          "default": false
        },
        "delayThresholdMs": {
          "title": "Late threshold (ms)",
          "description": "Confirmations slower than this count as late.",
          "type": "integer",
          "default": 120,
          "minimum": 0,
          "maximum": 1000
        },
        "ghosts": {
          "title": "Log ghost hits",
          "description": "Log predicted hits the server never confirmed.",
          "type": "boolean",
          "default": false
        }
      }
    },
    "hooks": {
      "title": "Game hooks",
      "description": "Where to find the game functions. Signatures are specific to one Minecraft version; leave them empty and the mod stays idle.",
      "type": "object",
      "default": {
        "moduleName": "libminecraftpe.so",
        "attackSignature": "",
        "attackTargetArg": 1,
        "entityEventSignature": "",
        "hurtEventId": 2
      },
      "properties": {
        "moduleName": {
          "title": "Game library",
          "description": "Library the signatures are searched in.",
          "type": "string",
          "default": "libminecraftpe.so"
        },
        "attackSignature": {
          "title": "Attack function signature",
          "description": "Symbol or byte pattern of the function called when the local player attacks an entity.",
          "type": "string",
          "default": ""
        },
        "attackTargetArg": {
          "title": "Target argument index",
          "description": "Which argument of the attack function is the target entity (0 = this, 1 = first parameter).",
          "type": "integer",
          "default": 1,
          "minimum": 0,
          "maximum": 5
        },
        "entityEventSignature": {
          "title": "Entity event handler signature",
          "description": "Symbol or byte pattern of the function that receives entity events (this, event id, data).",
          "type": "string",
          "default": ""
        },
        "hurtEventId": {
          "title": "Hurt event id",
          "description": "Event id that plays the hurt animation (2 = HURT_ANIMATION in the Bedrock protocol).",
          "type": "integer",
          "default": 2,
          "minimum": 0,
          "maximum": 255
        }
      }
    }
  }
}
