{
  "version": 1,
  "enabled": true,
  "hitreg": {
    "hurtFlash": true,
    "reconcileWindowMs": 250,
    "hurtCooldownMs": 500
  },
  "alerts": {
    "delays": false,
    "delayThresholdMs": 120,
    "ghosts": false
  },
  "hooks": {
    "moduleName": "libminecraftpe.so",
    "attackSignature": "",
    "attackTargetArg": 1,
    "entityEventSignature": "",
    "hurtEventId": 2
  }
}
